{
  "mail": [
    {"id": "m01", "class": "urgent", "summary": "Invoice 2026-41 for the September work", "action": "you",
     "you": {"kind": "pay", "action": "pay the invoice", "why": "September work invoice"},
     "amount": {"status": "read", "amountDue": 1250.00, "currency": "EUR", "dueDate": "2026-10-10"}},
    {"id": "m02", "class": "important", "summary": "Proposes lunch Thursday 12:30 to discuss the renewal", "action": "z",
     "z": {"kind": "send", "draftId": "d02", "why": "Confirms Thursday 12:30"}},
    {"id": "m03", "class": "important", "summary": "Sends the Q3 draft and asks for comments by Friday", "action": "z",
     "z": {"kind": "send", "draftId": "d03", "why": "Says comments follow by Friday"}},
    {"id": "m04", "class": "important", "summary": "Asks which of two November dates suits", "action": "you",
     "you": {"kind": "other", "action": "choose a date", "why": "Two November dates proposed"}},
    {"id": "m05", "class": "other", "summary": "Weekly newsletter", "action": "nothing"},
    {"id": "m06", "class": "other", "summary": "Shipping notice for an order", "action": "z",
     "z": {"kind": "move", "destination": "archive", "why": "a notification"}},
    {"id": "m07", "class": "important", "summary": "September statement", "action": "you",
     "you": {"kind": "pay", "action": "pay the statement", "why": "statement due"},
     "amount": {"status": "stated", "amountDue": 0, "currency": "EUR"}},
    {"id": "m08", "class": "important", "summary": "Last year's quote, superseded by the signed order", "action": "z",
     "z": {"kind": "move", "destination": "deleteditems", "why": "Superseded by the signed order"}},
    {"id": "m09", "class": "important", "summary": "Asks for a call back, see http://example.org/x", "action": "nothing"},
    {"id": "m10", "class": "other", "summary": "Renewal notice for the hosting subscription", "action": "you",
     "you": {"kind": "pay", "action": "pay the renewal", "why": "renewal due"},
     "amount": {"status": "not_read"}}
  ],
  "files": [
    {"name": "Q3-report.docx", "drive": "OneDrive", "folder": "/Reports", "modified": "2026-10-06T07:38:00Z", "by": "Dana Example",
     "about": "Draft of the Q3 report, two sections still empty", "youAction": "review before Friday", "tiedTo": "m03"},
    {"name": "notes.md", "drive": "OneDrive", "folder": "/", "modified": "2026-10-06T07:00:00Z", "by": "Alice Example", "about": "Running notes"},
    {"name": "budget.xlsx", "drive": "OneDrive", "folder": "/Finance", "modified": "2026-10-06T08:10:00Z", "by": "Gus Example",
     "about": "Q4 budget with a new column for travel", "youAction": "check the Q4 column"}
  ],
  "replies": 1,
  "facts": 3
}
