{
  "mail": [
    {
      "id": "m10",
      "class": "urgent",
      "summary": "Invoice 2026-41 for the September work",
      "action": "you",
      "you": {
        "kind": "pay",
        "action": "pay the invoice",
        "why": "September work invoice"
      },
      "amount": {
        "status": "read",
        "amountDue": 1250.0,
        "currency": "EUR",
        "dueDate": "2026-10-10"
      }
    },
    {
      "id": "m11",
      "class": "important",
      "summary": "Proposes lunch Thursday 12:30",
      "action": "nothing"
    },
    {
      "id": "m12",
      "class": "important",
      "summary": "Sends the Q3 draft and asks for comments by Friday",
      "action": "z",
      "z": {
        "kind": "send",
        "draftId": "d12",
        "why": "Says comments follow by Friday"
      }
    },
    {
      "id": "m13",
      "class": "important",
      "summary": "Asks which of two November dates suits",
      "action": "z",
      "z": {
        "kind": "move",
        "destination": "archive",
        "why": "a notification"
      }
    }
  ],
  "files": [
    {
      "name": "Q3-report.docx",
      "drive": "OneDrive",
      "folder": "/Reports",
      "modified": "2026-10-06T07:38:00Z",
      "by": "Dana Example",
      "about": "Draft of the Q3 report, two sections still empty",
      "youAction": "review before Friday",
      "tiedTo": "m12"
    }
  ],
  "replies": 1,
  "facts": 2
}
